{
  "schemaVersion": "1.0",
  "authoritative": true,
  "source": {
    "reviewedBy": "FOLIO Technical Council",
    "reference": "platform-lsp; docs/s009-library-baseline.md"
  },
  "families": [
    {
      "id": "edge-caiasoft",
      "displayName": "Edge CaiaiSoft API",
      "canonicalRepositories": [],
      "acceptance": {
        "kind": "legacy-baseline",
        "reference": "platform-lsp"
      }
    },
    {
      "id": "edge-connexion",
      "displayName": "edge-connexion",
      "canonicalRepositories": [],
      "acceptance": {
        "kind": "legacy-baseline",
        "reference": "platform-lsp"
      }
    },
    {
      "id": "edge-courses",
      "displayName": "Retrieve course-reserve information Edge API",
      "canonicalRepositories": [],
      "acceptance": {
        "kind": "legacy-baseline",
        "reference": "platform-lsp"
      }
    },
    {
      "id": "edge-dcb",
      "displayName": "Edge DCB API",
      "canonicalRepositories": [],
      "acceptance": {
        "kind": "legacy-baseline",
        "reference": "platform-lsp"
      }
    },
    {
      "id": "edge-dematic",
      "displayName": "Edge Dematic API",
      "canonicalRepositories": [],
      "acceptance": {
        "kind": "legacy-baseline",
        "reference": "platform-lsp"
      }
    },
    {
      "id": "edge-erm",
      "displayName": "Retrieve license term information Edge API",
      "canonicalRepositories": [],
      "acceptance": {
        "kind": "legacy-baseline",
        "reference": "platform-lsp"
      }
    },
    {
      "id": "edge-fqm",
      "displayName": "Edge FQM API",
      "canonicalRepositories": [],
      "acceptance": {
        "kind": "legacy-baseline",
        "reference": "platform-lsp"
      }
    },
    {
      "id": "edge-inn-reach",
      "displayName": "INN-REACH system Edge API module",
      "canonicalRepositories": [],
      "acceptance": {
        "kind": "legacy-baseline",
        "reference": "platform-lsp"
      }
    },
    {
      "id": "edge-inventory",
      "displayName": "Retrieve inventory information Edge API",
      "canonicalRepositories": [],
      "acceptance": {
        "kind": "legacy-baseline",
        "reference": "platform-lsp"
      }
    },
    {
      "id": "edge-ncip",
      "displayName": "Edge NCIP",
      "canonicalRepositories": [],
      "acceptance": {
        "kind": "legacy-baseline",
        "reference": "platform-lsp"
      }
    },
    {
      "id": "edge-oai-pmh",
      "displayName": "OAI-PMH Edge API",
      "canonicalRepositories": [],
      "acceptance": {
        "kind": "legacy-baseline",
        "reference": "platform-lsp"
      }
    },
    {
      "id": "edge-orders",
      "displayName": "Acquisitions - Orders Edge API",
      "canonicalRepositories": [],
      "acceptance": {
        "kind": "legacy-baseline",
        "reference": "platform-lsp"
      }
    },
    {
      "id": "edge-patron",
      "displayName": "Patron Services Edge API",
      "canonicalRepositories": [],
      "acceptance": {
        "kind": "legacy-baseline",
        "reference": "platform-lsp"
      }
    },
    {
      "id": "edge-rtac",
      "displayName": "Real Time Availability Check Edge API",
      "canonicalRepositories": [],
      "acceptance": {
        "kind": "legacy-baseline",
        "reference": "platform-lsp"
      }
    },
    {
      "id": "edge-sip2",
      "displayName": "SIP2 Module",
      "canonicalRepositories": [],
      "acceptance": {
        "kind": "legacy-baseline",
        "reference": "platform-lsp"
      }
    },
    {
      "id": "edge-users",
      "displayName": "Retrieve and create users information Edge API",
      "canonicalRepositories": [],
      "acceptance": {
        "kind": "legacy-baseline",
        "reference": "platform-lsp"
      }
    },
    {
      "id": "folio_acquisition-units",
      "displayName": "Acquisition units",
      "canonicalRepositories": [],
      "acceptance": {
        "kind": "legacy-baseline",
        "reference": "platform-lsp"
      }
    },
    {
      "id": "folio_agreements",
      "displayName": "ERM agreement functionality for Stripes",
      "canonicalRepositories": [],
      "acceptance": {
        "kind": "legacy-baseline",
        "reference": "platform-lsp"
      }
    },
    {
      "id": "folio_authorization-policies",
      "displayName": "FOLIO app for Authorization Policies",
      "canonicalRepositories": [],
      "acceptance": {
        "kind": "legacy-baseline",
        "reference": "platform-lsp"
      }
    },
    {
      "id": "folio_authorization-roles",
      "displayName": "FOLIO app for Authorization Roles",
      "canonicalRepositories": [],
      "acceptance": {
        "kind": "legacy-baseline",
        "reference": "platform-lsp"
      }
    },
    {
      "id": "folio_bulk-edit",
      "displayName": "Description for bulk edit",
      "canonicalRepositories": [],
      "acceptance": {
        "kind": "legacy-baseline",
        "reference": "platform-lsp"
      }
    },
    {
      "id": "folio_calendar",
      "displayName": "Calendar settings",
      "canonicalRepositories": [],
      "acceptance": {
        "kind": "legacy-baseline",
        "reference": "platform-lsp"
      }
    },
    {
      "id": "folio_checkin",
      "displayName": "Item Check-in",
      "canonicalRepositories": [],
      "acceptance": {
        "kind": "legacy-baseline",
        "reference": "platform-lsp"
      }
    },
    {
      "id": "folio_checkout",
      "displayName": "Item Check-out",
      "canonicalRepositories": [],
      "acceptance": {
        "kind": "legacy-baseline",
        "reference": "platform-lsp"
      }
    },
    {
      "id": "folio_circulation",
      "displayName": "Circulation manager",
      "canonicalRepositories": [],
      "acceptance": {
        "kind": "legacy-baseline",
        "reference": "platform-lsp"
      }
    },
    {
      "id": "folio_circulation-log",
      "displayName": "Description for circulation logs",
      "canonicalRepositories": [],
      "acceptance": {
        "kind": "legacy-baseline",
        "reference": "platform-lsp"
      }
    },
    {
      "id": "folio_claims",
      "displayName": "UI module for claiming",
      "canonicalRepositories": [],
      "acceptance": {
        "kind": "legacy-baseline",
        "reference": "platform-lsp"
      }
    },
    {
      "id": "folio_consortia-settings",
      "displayName": "Consortia settings",
      "canonicalRepositories": [],
      "acceptance": {
        "kind": "legacy-baseline",
        "reference": "platform-lsp"
      }
    },
    {
      "id": "folio_courses",
      "displayName": "Maintain courses and reserve items for them",
      "canonicalRepositories": [],
      "acceptance": {
        "kind": "legacy-baseline",
        "reference": "platform-lsp"
      }
    },
    {
      "id": "folio_dashboard",
      "displayName": "Dashboard app for configurable FOLIO widgets",
      "canonicalRepositories": [],
      "acceptance": {
        "kind": "legacy-baseline",
        "reference": "platform-lsp"
      }
    },
    {
      "id": "folio_data-export",
      "displayName": "Data export manager",
      "canonicalRepositories": [],
      "acceptance": {
        "kind": "legacy-baseline",
        "reference": "platform-lsp"
      }
    },
    {
      "id": "folio_data-import",
      "displayName": "Data Import manager",
      "canonicalRepositories": [],
      "acceptance": {
        "kind": "legacy-baseline",
        "reference": "platform-lsp"
      }
    },
    {
      "id": "folio_developer",
      "displayName": "Developer settings",
      "canonicalRepositories": [],
      "acceptance": {
        "kind": "legacy-baseline",
        "reference": "platform-lsp"
      }
    },
    {
      "id": "folio_eholdings",
      "displayName": "FOLIO UI module for eHoldings",
      "canonicalRepositories": [],
      "acceptance": {
        "kind": "legacy-baseline",
        "reference": "platform-lsp"
      }
    },
    {
      "id": "folio_erm-comparisons",
      "displayName": "ERM app for comparison of Agreement and Package objects",
      "canonicalRepositories": [],
      "acceptance": {
        "kind": "legacy-baseline",
        "reference": "platform-lsp"
      }
    },
    {
      "id": "folio_erm-usage",
      "displayName": "eUsage Module",
      "canonicalRepositories": [],
      "acceptance": {
        "kind": "legacy-baseline",
        "reference": "platform-lsp"
      }
    },
    {
      "id": "folio_export-manager",
      "displayName": "Description for export manager",
      "canonicalRepositories": [],
      "acceptance": {
        "kind": "legacy-baseline",
        "reference": "platform-lsp"
      }
    },
    {
      "id": "folio_finance",
      "displayName": "Description for ui-finance",
      "canonicalRepositories": [],
      "acceptance": {
        "kind": "legacy-baseline",
        "reference": "platform-lsp"
      }
    },
    {
      "id": "folio_gobi-settings",
      "displayName": "GOBI integration settings",
      "canonicalRepositories": [],
      "acceptance": {
        "kind": "legacy-baseline",
        "reference": "platform-lsp"
      }
    },
    {
      "id": "folio_handler-stripes-registry",
      "displayName": "frontend registry for Stripes",
      "canonicalRepositories": [],
      "acceptance": {
        "kind": "legacy-baseline",
        "reference": "platform-lsp"
      }
    },
    {
      "id": "folio_inn-reach",
      "displayName": "Description for inn-reach",
      "canonicalRepositories": [],
      "acceptance": {
        "kind": "legacy-baseline",
        "reference": "platform-lsp"
      }
    },
    {
      "id": "folio_inventory",
      "displayName": "Inventory manager",
      "canonicalRepositories": [],
      "acceptance": {
        "kind": "legacy-baseline",
        "reference": "platform-lsp"
      }
    },
    {
      "id": "folio_inventory-import",